﻿﻿evidence_extract_id,evidence_id,linked_window_id,event_date,evidence_strength,source_kind,source_title,source_url,core_semantic,training_implication,extract_status,review_judgement
ca_extract_001,ca_backfill_001,ca_train_window_007,2025-03-05,p0,official_report_followthrough,2025年政府工作报告提出推动商业航天等新兴产业安全健康发展,https://www.news.cn/info/20250311/96a15220e6544be6a8ef56c99cb548b5/c.html,Government-work-report level direction anchor explicitly places commercial aerospace inside the national new-industry development agenda,This should be treated as the earliest top-down direction anchor rather than as a short-lived theme headline,extracted_from_secondary_official_interpretation,accepted_as_p0_direction_anchor
ca_extract_002,ca_backfill_002,ca_train_window_007,2025-11-25,p0,national_agency_policy,国家航天局推进商业航天高质量安全发展行动计划（2025—2027年）,https://www.cnsa.gov.cn/n6758823/n6758839/c10719382/content.html,The action plan formally incorporates commercial aerospace into the national aerospace development layout and sets 2027 development goals plus implementation measures,This is the strongest formal training anchor for learning how policy converts a concept into a multi-quarter direction,extracted_from_primary_official_source,accepted_as_p0_direction_anchor
ca_extract_003,ca_backfill_002,ca_train_window_007,2025-11-25,p0,national_agency_policy_detail,国家航天局行动计划重点举措：开放国家科研项目 推动成果商业化应用 建设创新平台,https://www.cnsa.gov.cn/n6758823/n6758839/c10719382/content.html,The policy is not vague encouragement only; it includes concrete measures around project openness commercialization and innovation-platform building,This should teach the model that strong policy anchors often come with implementation texture rather than slogans only,extracted_from_primary_official_source,accepted_as_p0_direction_detail
ca_extract_004,ca_backfill_006,ca_train_window_009,2026-03-05,p1,market_media_policy_bridge,报告解读丨打造航空航天新兴支柱产业，代表提到了“太空算力”,https://finance.sina.com.cn/jjxw/2026-03-05/doc-inhpxnft3280509.shtml,The market linked the government-work-report aerospace direction to a new subtheme called space compute and framed it as a strategic future industry leg,This is a classic cross-narrative bridge sample and should be tagged as a candidate new-leg narrative rather than as a stand-alone board-wide ignition,extracted_from_market_media,accepted_as_p1_cross_narrative_bridge
ca_extract_005,ca_backfill_006,ca_train_window_009,2026-03-05,p1,market_media_policy_bridge_detail,太空算力建议：纳入航天强国建设总体布局并加快专项支持政策,https://finance.sina.com.cn/jjxw/2026-03-05/doc-inhpxnft3280509.shtml,The article does not only mention a buzzword; it explicitly proposes policy support project approval acceleration and market-participation activation for compute constellations,This should train the distinction between a pure overseas buzzword and a narrative that starts to seek domestic policy landing,extracted_from_market_media,accepted_as_p1_cross_narrative_detail
ca_extract_006,ca_backfill_009,ca_train_window_010,2026-03-13,p1,official_launch_milestone,长八甲火箭成功发射卫星互联网低轨20组卫星,https://www.cnsa.gov.cn/n6758823/n6758838/index.html,The national space-agency news feed records a concrete commercial-launch-related milestone tying launch progress to satellite internet deployment rather than to abstract theme heat,This should be used as a launch-progress archetype for learning when a real milestone can support a subtheme leg,extracted_from_primary_official_index,accepted_as_p1_launch_progress_anchor
ca_extract_007,ca_backfill_009,ca_train_window_010,2026-03-16,p1,official_launch_milestone,快舟十一号遥七运载火箭发射成功,https://www.cnsa.gov.cn/n6758823/n6758838/index.html,The official news stream shows another concrete multi-satellite launch success in the same period which can be used to study whether repeated launch milestones broaden or merely sustain attention,This should help distinguish milestone density from board-wide ignition and test whether repeated progress creates diffusion or only background persistence,extracted_from_primary_official_index,accepted_as_p1_launch_progress_anchor
ca_extract_008,ca_backfill_004,ca_train_window_008,2025-12-22,p1,industry_conference_chain,2025文昌国际航空航天论坛开幕,https://hi.people.com.cn/n2/2025/1222/c231190-41450781.html,The Wenchang forum bundled commercial-space capital satellite-data application aerospace industry and空天信息 sub-forums into one concentrated conference chain,This should train how conference chains expand an already forming theme into multiple subtheme discussion lanes rather than acting as a stand-alone broad-board ignition,extracted_from_search_snippet,accepted_as_p1_conference_chain_anchor
ca_extract_009,ca_backfill_004,ca_train_window_008,2025-12-22,p1,industry_conference_chain_detail,文昌论坛包含商业航天资本高峰论坛和空天信息产业发展论坛,https://hi.people.com.cn/n2/2025/1222/c231190-41450781.html,The conference content itself matters because it simultaneously touches capital deployment satellite data applications and空天信息产业落地,This should be tagged as subtheme-diffusion evidence rather than as a pure sentiment headline,extracted_from_search_snippet,accepted_as_p1_conference_chain_detail
ca_extract_010,ca_backfill_005,ca_train_window_008,2025-12-24,p1,industry_conference_chain,2025第三届商业航天发展大会在京开幕,https://bj.people.com.cn/n2/2025/1224/c14540-41452906.html,The Beijing commercial-space conference marks a dense catalyst period and should be treated as a formal industry-conference reinforcement rather than as a generic media mention,This should help distinguish a real conference-chain reinforcement from casual thematic chatter,extracted_from_search_snippet,accepted_as_p1_conference_chain_anchor
ca_extract_011,ca_backfill_005,ca_train_window_008,2025-12-24,p1,industry_conference_chain_detail,商业航天进入密集催化期并与中关村商业航天大会联动,https://cn.investing.com/news/stock-market-news/article-3138689,The event timing indicates a cluster of institutional and industry-attention catalysts rather than a single isolated conference,This should be used to learn conference-density as a reinforcement mechanism that may support diffusion but still needs price and breadth confirmation,extracted_from_market_media_summary,accepted_as_p1_conference_chain_detail
ca_extract_012,ca_backfill_005,ca_train_window_008,2025-02-12,p1,regional_industry_conference,北京商业航天产业高质量发展大会在经开区举办,https://www.beijing.gov.cn/ywdt/gzdt/202502/t20250213_4010000.html,This official municipal conference tied policy departments enterprises and finance together around commercial-space development and high-quality safety development,This should be used as a regional conference-chain sample that is stronger than media heat but weaker than national direction anchors,extracted_from_official_search_snippet,accepted_as_p1_regional_conference_anchor
ca_extract_013,ca_backfill_003,ca_train_window_007,2025-12-30,p1,central_system_followthrough,国防科工局：促进商业航天发展 推动航天产业化,https://finance.people.com.cn/n1/2025/1230/c1004-40635700.html,The central-system signal reinforced that commercial aerospace should move from technology validation toward industrialization and sector development,This should be treated as a direction-reinforcement anchor between the national action plan and the January board ignition,extracted_from_search_snippet,accepted_as_p1_direction_reinforcement
ca_extract_014,ca_backfill_012,ca_train_window_008,2026-01-22,p1,municipal_industry_conference,第三届北京商业航天产业高质量发展推进会将在北京经开区举办,https://kw.beijing.gov.cn/xwdt/kcyx/kcyxkchd/202601/t20260122_4455459.html,The January Beijing conference explicitly framed 2026 as a窗口期 and bundled成果发布 主旨报告 专题座谈 投融资与元器件可靠性等多条催化链,This should be used as the January continuation anchor that upgrades the conference chain from single-event attention to multi-session diffusion,extracted_from_primary_municipal_source,accepted_as_p1_conference_chain_continuation
ca_extract_015,ca_backfill_013,ca_train_window_002,2026-01-07,p1,market_policy_followthrough,商业航天“国家队”出手 产业发展动力足,https://finance.people.com.cn/n1/2026/0107/c1004-40640610.html,The January 7 scale-up commentary framed 2025 launch density and reusable-rocket engineering validation as a规模化发展拐点 immediately before the board ignition window,This should reinforce that the January move had a scale-up backdrop rather than being only a short-lived concept burst,extracted_from_search_snippet,accepted_as_p1_scale_up_reinforcement
