task_id,task_name,input_slice,target_output,primary_question,label_dependency,minimum_context,success_criteria,review_priority,notes
ca_task_001,top_down_direction_task,policy_or_event_window,policy_anchor_state,Does this window define a medium-term board direction or is it only media heat,policy_anchor_state|trigger_role,Need event text plus time-aligned board context around the policy date,Correctly separate national/ministry/industrial anchors from media-only stories,p0,This is the root task because all later routing depends on whether direction is real.
ca_task_002,new_leg_or_old_echo_task,event_plus_history_window,novelty_class,Is this event a fresh tradable leg or only an old theme echo,novelty_class|catalyst_type|trigger_role,Need prior theme history and at least one pre-event context window,Correctly identify whether a catalyst creates new expansion rather than narrative repetition,p0,This directly addresses the user's concern that not every good headline creates a new move.
ca_task_003,breadth_regime_task,board_structure_window,breadth_state,Is the board moving broadly or only structurally through a narrow slice,breadth_state|position_state|breakout_state,Need board constituents or representative breadth proxies across the same window,Correctly classify broad-based rally versus selective subtheme rally versus failed diffusion,p1,This teaches the system to distinguish board-wide repricing from local spikes.
ca_task_004,capital_confirmation_task,price_volume_window,capital_state,Is the move actually funded or mostly headline-driven,capital_state|breadth_state,Need turnover and relative participation around the event window,Correctly separate capital-driven rebound from headline-only rebound,p1,This is the core bridge from news to tradability.
ca_task_005,structure_gate_task,event_plus_symbol_structure_window,tradability_label,Even if the narrative is right can the stock actually be traded now,tradability_label|position_state|breakout_state|capital_state,Need symbol-level structure and board context together,Correctly classify tradable_now vs watch_only vs not_tradable,p0,This is the final gate that links policy and news to stock selection.
ca_task_006,policy_to_subtheme_diffusion_task,policy_then_subtheme_window,trigger_role,Did a later small catalyst act as ignition confirmation diffusion or mere rebound,trigger_role|novelty_class|breadth_state,Need a top-down anchor window followed by at least one smaller catalyst window,Correctly identify how small catalysts behave once the main policy direction already exists,p1,This task is specific to the user's航天学习目标 and should be central to the sample band.
