symbol,display_name,candidate_role,separated_role,source_backing,event_registry_id,event_scope,decisive_semantic,decisive_retained,decisive_reason,source_hardness,hardness_reasoning
000547,航天发展,attention_anchor_and_attention_decoy,,ca_source_007 + local_path,ca_source_007,theme_heat,turning_point_watch,True,decisive_turning_point_risk,hard_anchor_grade_source,explicit symbol-named turning-point theme-heat source retained as decisive risk seed
603601,再升科技,crowded_attention_carrier_candidate,event_backed_attention_carrier_candidate,ca_source_010 + crowding_module,ca_source_010,supply_chain_validation,continuation_enabler,True,supply_chain_validation,retained_continuation_support_source,"retained supply-chain validation source supports continuation and carrier watch, but it is not a direct heat-axis naming source"
002361,神剑股份,crowding_only_role_candidate,non_anchor_crowded_concentration_candidate,crowding_module_only,,,,,,no_retained_event_source,current local role is built from crowding path only and has no retained event source to harden anchor status
300342,天银机电,outlier_breakout_concentration_candidate,non_anchor_outlier_breakout_candidate,ca_source_004_theme_heat + local_breakout_path,ca_source_004,theme_heat,discarded_theme_heat,False,non_decisive_theme_heat_excluded,discarded_theme_heat_source,"theme-heat source exists, but it was explicitly discarded as non-decisive and cannot support hard anchor promotion"
301306,西测测试,high_beta_attention_follow_candidate,event_backed_high_beta_follow_candidate,ca_source_011 + raw_only_rebound,ca_source_011,supply_chain_validation,continuation_enabler,True,supply_chain_validation,retained_follow_support_source,"retained supply-chain validation source supports follow behavior, but current evidence still reads as follower-grade rather than anchor-grade"
